{
  "$schema": "https://json-schema.org/draft/2020-12/schema",
  "$id": "https://github.com/robin-shiels/ai-project-bootstrap/plugins/ai-bootstrap/skills/einrichtung/references/STATE.schema.json",
  "title": "AI Bootstrap Einrichtungsstand",
  "description": "Portabler, geheimnisfreier Stand der persoenlichen Einrichtung (Version 2). Dieses Dokument beschreibt das Format. Die tatsaechliche Pruefung macht scripts/onboarding_state.py im Ordner des Skills einrichtung (oder die KI anhand dieses Schemas, solange Python fehlt). Staende der Version 1 werden mit 'migrate' umgeschrieben.",
  "type": "object",
  "additionalProperties": false,
  "required": [
    "schema_version",
    "bundle_version",
    "provider_path",
    "platform",
    "current_step",
    "decisions",
    "verifications",
    "blockers",
    "next_action"
  ],
  "properties": {
    "schema_version": {
      "const": 2
    },
    "bundle_version": {
      "type": "string",
      "pattern": "^[0-9]+\\.[0-9]+\\.[0-9]+$"
    },
    "provider_path": {
      "enum": [
        "chatgpt-codex",
        "claude-code",
        "unknown"
      ]
    },
    "platform": {
      "enum": [
        "macos",
        "windows",
        "linux",
        "unknown"
      ]
    },
    "current_step": {
      "$ref": "#/$defs/step"
    },
    "decisions": {
      "type": "array",
      "items": {
        "type": "object",
        "additionalProperties": false,
        "required": [
          "id",
          "answer",
          "source",
          "decided_at"
        ],
        "properties": {
          "id": {
            "type": "string",
            "pattern": "^[a-z][a-z0-9_]*$"
          },
          "answer": {
            "type": "string",
            "minLength": 1,
            "maxLength": 300
          },
          "source": {
            "enum": [
              "user_choice",
              "user_own_answer",
              "default_after_notice"
            ]
          },
          "decided_at": {
            "$ref": "#/$defs/date"
          }
        }
      }
    },
    "verifications": {
      "type": "array",
      "items": {
        "type": "object",
        "additionalProperties": false,
        "required": [
          "step",
          "checked_at",
          "scope",
          "source",
          "context",
          "result",
          "detail"
        ],
        "properties": {
          "step": {
            "$ref": "#/$defs/step"
          },
          "checked_at": {
            "$ref": "#/$defs/date"
          },
          "scope": {
            "enum": [
              "account",
              "chat_access",
              "host",
              "repository",
              "project"
            ]
          },
          "source": {
            "enum": [
              "tool_check",
              "user_confirmation"
            ]
          },
          "context": {
            "type": "string",
            "minLength": 1,
            "maxLength": 120
          },
          "result": {
            "enum": [
              "ok",
              "failed"
            ]
          },
          "detail": {
            "type": "string",
            "maxLength": 300
          }
        }
      }
    },
    "blockers": {
      "type": "array",
      "items": {
        "type": "object",
        "additionalProperties": false,
        "required": [
          "step",
          "description",
          "since"
        ],
        "properties": {
          "step": {
            "$ref": "#/$defs/step"
          },
          "description": {
            "type": "string",
            "minLength": 1,
            "maxLength": 300
          },
          "since": {
            "$ref": "#/$defs/date"
          }
        }
      }
    },
    "next_action": {
      "type": "string",
      "minLength": 1,
      "maxLength": 300
    }
  },
  "$defs": {
    "date": {
      "type": "string",
      "pattern": "^[0-9]{4}-[0-9]{2}-[0-9]{2}(T[0-9]{2}:[0-9]{2}(:[0-9]{2})?(Z|[+-][0-9]{2}:[0-9]{2})?)?$"
    },
    "step": {
      "enum": [
        "start",
        "github",
        "skills",
        "arbeitsweise",
        "projekt",
        "probelauf",
        "fertig",
        "gate"
      ]
    }
  }
}
